{
  "schemaVersion": 1,
  "kind": "skill-family.host-descriptor",
  "hostId": "codebuddy",
  "displayName": "CodeBuddy",
  "support": "manual",
  "maturity": "manual",
  "verification": {
    "driverId": "codebuddy-print-v1",
    "authStrategy": "existing-user-state",
    "credentialMutation": "host-managed"
  },
  "sourceAliases": [],
  "pathCategories": [],
  "probeCapabilities": [
    "cli",
    "version",
    "payload",
    "registry",
    "discover",
    "enabled",
    "reload",
    "smoke",
    "uninstall"
  ]
}
